{
  "$schema": "../../../calendar.schema.json",
  "crop": "Potato",
  "app_crop": "Potato",
  "zones": [
    "dry"
  ],
  "regions": [
    "Jaffna District (DL-3: Kopai, Neerveli, Urumpirai, Punnaleikattuwan, Kuppulan, Chunnakam, Achchuveli, Siruppatti, Puttur)",
    "Kalpitiya (Puttalam District) (DL-3: Kandakkuliya, Norochchole, Palavi)"
  ],
  "irrigation": [
    "irrigated"
  ],
  "source_file": "data-source/rgb/Potato/POTATO_-Dry-jaffna-Kalpitiya.png",
  "source_year": 2013,
  "scenarios": [
    {
      "scenario": "main",
      "label": "Maha Season Upland Cultivation (Jaffna & Kalpitiya)",
      "cultivation_system": "upland",
      "harvest_type": null,
      "season_windows": [
        {
          "season": "Maha",
          "plant_from": {
            "month": 11,
            "week": 1
          },
          "plant_to": {
            "month": 11,
            "week": 2
          },
          "confidence": "high",
          "hint": true,
          "verified": false
        }
      ],
      "varieties": [
        {
          "id": "calwhite",
          "name": "Calwhite",
          "age_group": null,
          "duration_days": null,
          "yield_range_kg_ac": [
            16000,
            16000
          ],
          "confidence": "high",
          "notes": "Standard variety for Dry Zone cultivation. Standard yield from economics table: 16,000 kg/ac."
        },
        {
          "id": "redlasoda",
          "name": "Redlasoda",
          "age_group": null,
          "duration_days": null,
          "yield_range_kg_ac": [
            16000,
            16000
          ],
          "confidence": "high",
          "notes": "Standard variety for Dry Zone cultivation. Standard yield from economics table: 16,000 kg/ac."
        },
        {
          "id": "arnova",
          "name": "Arnova",
          "age_group": null,
          "duration_days": null,
          "yield_range_kg_ac": [
            16000,
            16000
          ],
          "confidence": "high",
          "notes": "Standard variety for Dry Zone cultivation. Standard yield from economics table: 16,000 kg/ac."
        },
        {
          "id": "desiree",
          "name": "Desiree",
          "age_group": null,
          "duration_days": null,
          "yield_range_kg_ac": [
            16000,
            16000
          ],
          "confidence": "high",
          "notes": "Standard variety for Dry Zone cultivation. Standard yield from economics table: 16,000 kg/ac."
        }
      ],
      "operations": [
        {
          "key": "land_preparation",
          "label": "Land Preparation",
          "hint": true,
          "verified": false,
          "original_grid_position": {
            "season": "Maha",
            "maha_month": 10,
            "yala_month": null,
            "month": 10,
            "weeks": [
              3,
              4
            ],
            "yala_weeks": null
          },
          "confidence": "high",
          "details": "Land preparation with tractor: Oct W3-W4"
        },
        {
          "key": "liming",
          "label": "Liming",
          "hint": true,
          "verified": false,
          "original_grid_position": {
            "season": "Maha",
            "maha_month": 10,
            "yala_month": null,
            "month": 10,
            "weeks": [
              3,
              4
            ],
            "yala_weeks": null
          },
          "confidence": "high",
          "details": "Liming of soil to correct soil acidity: Oct W3-W4"
        },
        {
          "key": "organic_fertilizer",
          "label": "Application of Organic Fertilizer",
          "hint": true,
          "verified": false,
          "original_grid_position": {
            "season": "Maha",
            "maha_month": 10,
            "yala_month": null,
            "month": 10,
            "weeks": [
              3,
              4
            ],
            "yala_weeks": null
          },
          "confidence": "high",
          "details": "Application of organic fertilizer (10 tons/ha): Oct W3-W4"
        },
        {
          "key": "basal_dressing",
          "label": "Basal Dressing",
          "hint": true,
          "verified": false,
          "original_grid_position": {
            "season": "Maha",
            "maha_month": 11,
            "yala_month": null,
            "month": 11,
            "weeks": [
              1,
              2
            ],
            "yala_weeks": null
          },
          "confidence": "high",
          "details": "Basal fertilizer application: Nov W1-W2"
        },
        {
          "key": "seeding",
          "label": "Seeding",
          "hint": true,
          "verified": false,
          "original_grid_position": {
            "season": "Maha",
            "maha_month": 11,
            "yala_month": null,
            "month": 11,
            "weeks": [
              1,
              2
            ],
            "yala_weeks": null
          },
          "confidence": "high",
          "details": "Planting seed potato tubers (28-55 mm size, 5-6 active suckers): Nov W1-W2"
        },
        {
          "key": "earthing_up",
          "label": "Earthing Up",
          "hint": true,
          "verified": false,
          "original_grid_position": {
            "season": "Maha",
            "maha_month": 11,
            "yala_month": null,
            "month": 11,
            "weeks": [
              3,
              4
            ],
            "yala_weeks": null
          },
          "confidence": "high",
          "details": "Earthing up soil to create ridges: Nov W3-W4"
        },
        {
          "key": "top_dressing_1",
          "label": "Top Dressing (2 weeks)",
          "hint": true,
          "verified": false,
          "original_grid_position": {
            "season": "Maha",
            "maha_month": 11,
            "yala_month": null,
            "month": 11,
            "weeks": [
              3,
              4
            ],
            "yala_weeks": null
          },
          "confidence": "high",
          "details": "Top dressing 2 weeks after planting: Nov W3-W4"
        },
        {
          "key": "top_dressing_2",
          "label": "Top Dressing (3-4 weeks)",
          "hint": true,
          "verified": false,
          "original_grid_position": {
            "season": "Maha",
            "maha_month": 12,
            "yala_month": null,
            "month": 12,
            "weeks": [
              1,
              2
            ],
            "yala_weeks": null
          },
          "confidence": "high",
          "details": "Top dressing 3-4 weeks after planting: Dec W1-W2"
        },
        {
          "key": "pest_control",
          "label": "Pest Control",
          "hint": true,
          "verified": false,
          "original_grid_position": {
            "season": "Maha",
            "maha_month": 12,
            "yala_month": null,
            "month": 12,
            "weeks": [
              1,
              2
            ],
            "yala_weeks": null
          },
          "confidence": "high",
          "details": "Pest control: Dec W1-W2. Apply suitable insecticide to control cut worms at early stage; apply fungicides during heavy rainy conditions."
        },
        {
          "key": "harvesting",
          "label": "Harvesting",
          "hint": true,
          "verified": false,
          "original_grid_position": {
            "season": "Maha",
            "maha_month": 1,
            "yala_month": null,
            "month": 1,
            "weeks": [
              3,
              4
            ],
            "yala_weeks": null
          },
          "confidence": "high",
          "details": "Harvesting mature potato tubers: Jan W3-W4, Feb W2-W3, Mar W1-W2"
        }
      ],
      "fertilizer_schedule": [
        {
          "timing_label": "Basal Dressing (Jaffna)",
          "timing_schemes": {
            "days_after_broadcasting": null,
            "weeks_after_broadcasting": null,
            "weeks_after_planting": 0
          },
          "urea_kg_ac": 22.3,
          "tsp_kg_ac": 109.3,
          "mop_kg_ac": 50.6,
          "confidence": "high",
          "notes": "Jaffna district recommendation: Urea 55 kg/ha (22.3 kg/ac), TSP 270 kg/ha (109.3 kg/ac), MOP 125 kg/ha (50.6 kg/ac)."
        },
        {
          "timing_label": "Top Dressing - After 2 weeks of planting (Jaffna)",
          "timing_schemes": {
            "days_after_broadcasting": null,
            "weeks_after_broadcasting": null,
            "weeks_after_planting": 2
          },
          "urea_kg_ac": 44.5,
          "tsp_kg_ac": null,
          "mop_kg_ac": null,
          "confidence": "high",
          "notes": "Jaffna district recommendation: Urea 110 kg/ha (44.5 kg/ac)."
        },
        {
          "timing_label": "Top Dressing - After 3-4 weeks of planting (Jaffna)",
          "timing_schemes": {
            "days_after_broadcasting": null,
            "weeks_after_broadcasting": null,
            "weeks_after_planting": 4
          },
          "urea_kg_ac": 66.8,
          "tsp_kg_ac": null,
          "mop_kg_ac": 50.6,
          "confidence": "high",
          "notes": "Jaffna district recommendation: Urea 165 kg/ha (66.8 kg/ac), MOP 125 kg/ha (50.6 kg/ac)."
        },
        {
          "timing_label": "Basal Dressing (Kalpitiya)",
          "timing_schemes": {
            "days_after_broadcasting": null,
            "weeks_after_broadcasting": null,
            "weeks_after_planting": 0
          },
          "urea_kg_ac": null,
          "tsp_kg_ac": 109.3,
          "mop_kg_ac": null,
          "confidence": "high",
          "notes": "Kalpitiya area recommendation: TSP 270 kg/ha (109.3 kg/ac)."
        },
        {
          "timing_label": "Top Dressing - After 2 weeks of planting (Kalpitiya)",
          "timing_schemes": {
            "days_after_broadcasting": null,